{
  "schemaVersion": "1",
  "tool": "seo-rea",
  "toolVersion": "0.4.0",
  "kind": "reverse",
  "runId": "20261015T223928Z",
  "domain": "cardpointers.com",
  "timestamps": {
    "createdAt": "2026-10-15T22:39:28.348Z",
    "writtenAt": "2026-10-15T22:39:32.490Z"
  },
  "cost": {
    "usd": 0,
    "paidCalls": 0
  },
  "coverage": {
    "pagesCrawled": 70,
    "indexablePages": 59,
    "crawlComplete": true,
    "crawlReport": "report/crawl.json"
  },
  "summary": [
    {
      "claim": "Content is concentrated in /offers (25 of 59 indexable pages, mostly entity pages).",
      "basis": "observed",
      "confidence": "high",
      "evidenceIds": [
        "E001"
      ],
      "examples": [
        "https://cardpointers.com/offers/",
        "https://cardpointers.com/offers/menchies-frozen-yogurt-lake-nona-5-back-48/",
        "https://cardpointers.com/offers/tsuki-sushi-grill-5-back-50/"
      ]
    },
    {
      "claim": "Likely target topics (repeated across titles, H1s and URLs): \"offers\", \"credit card\", \"gift card\", \"amex\", \"apple\", \"pro\".",
      "basis": "inferred",
      "confidence": "medium",
      "evidenceIds": [
        "E001"
      ],
      "examples": [
        "https://cardpointers.com/extension/",
        "https://cardpointers.com/offers/",
        "https://cardpointers.com/cards/"
      ]
    },
    {
      "claim": "Page types that carry the site: entity (37), comparison (1), product (1).",
      "basis": "inferred",
      "confidence": "medium",
      "evidenceIds": [
        "E001"
      ],
      "examples": [
        "https://cardpointers.com/offers/menchies-frozen-yogurt-lake-nona-5-back-48/",
        "https://cardpointers.com/cards/",
        "https://cardpointers.com/app/"
      ]
    },
    {
      "claim": "Programmatic SEO: /offers/* (24 pages, titles \"... 5% back\"); /cards/* (13 pages, titles \"(varied titles, uniform layout)\").",
      "basis": "inferred",
      "confidence": "medium",
      "evidenceIds": [
        "E001"
      ],
      "examples": [
        "https://cardpointers.com/offers/menchies-frozen-yogurt-lake-nona-5-back-48/",
        "https://cardpointers.com/offers/tsuki-sushi-grill-5-back-50/",
        "https://cardpointers.com/offers/handels-homemade-ice-cream-oviedo-5-back/"
      ]
    },
    {
      "claim": "Internal linking: 22 links repeat on most pages (nav/footer); average 22.8 internal links per page; strongest internal hubs: /apps/iphone/, /apps/ipad/, /apps/watch/.",
      "basis": "observed",
      "confidence": "high",
      "evidenceIds": [
        "E001"
      ],
      "examples": [
        "https://cardpointers.com/apps/iphone/",
        "https://cardpointers.com/apps/ipad/",
        "https://cardpointers.com/apps/watch/"
      ]
    },
    {
      "claim": "AEO: llms.txt present and valid (13 links); AI crawlers blocked: none; FAQPage on 0 page(s); 0 question-style titles; 68% of pages readable without JavaScript.",
      "basis": "observed",
      "confidence": "high",
      "evidenceIds": [
        "E002",
        "E003",
        "E004",
        "E001"
      ],
      "examples": []
    },
    {
      "claim": "Stack fingerprints: Nuxt, Vue, HubSpot.",
      "basis": "observed",
      "confidence": "medium",
      "evidenceIds": [
        "E001"
      ],
      "examples": []
    },
    {
      "claim": "Authority signals (free): Tranco rank 365175; 0 Wikipedia article(s) link to it; unknown Common Crawl index page(s).",
      "basis": "observed",
      "confidence": "medium",
      "evidenceIds": [
        "E005",
        "E001"
      ],
      "examples": []
    }
  ],
  "keywords": [
    {
      "term": "offers",
      "pages": 3,
      "inTitles": 3,
      "examples": [
        "https://cardpointers.com/extension/",
        "https://cardpointers.com/offers/",
        "https://cardpointers.com/cards/"
      ]
    },
    {
      "term": "credit card",
      "pages": 2,
      "inTitles": 2,
      "examples": [
        "https://cardpointers.com/",
        "https://cardpointers.com/cards/"
      ]
    },
    {
      "term": "gift card",
      "pages": 2,
      "inTitles": 2,
      "examples": [
        "https://cardpointers.com/gift/",
        "https://cardpointers.com/gift/redeem/?id=undefined"
      ]
    },
    {
      "term": "amex",
      "pages": 2,
      "inTitles": 2,
      "examples": [
        "https://cardpointers.com/extension/",
        "https://cardpointers.com/offers/"
      ]
    },
    {
      "term": "apple",
      "pages": 2,
      "inTitles": 2,
      "examples": [
        "https://cardpointers.com/apps/watch/",
        "https://cardpointers.com/apps/vision/"
      ]
    },
    {
      "term": "pro",
      "pages": 2,
      "inTitles": 1,
      "examples": [
        "https://cardpointers.com/apps/vision/",
        "https://cardpointers.com/pro/"
      ]
    },
    {
      "term": "cards",
      "pages": 2,
      "inTitles": 0,
      "examples": [
        "https://cardpointers.com/",
        "https://cardpointers.com/cards/"
      ]
    }
  ],
  "clusters": [
    {
      "key": "/offers",
      "pages": 25,
      "share": 0.42,
      "template": "entity",
      "avgWords": 213,
      "schemaTypes": [],
      "topTerms": [],
      "hub": "https://cardpointers.com/offers/",
      "examples": [
        "https://cardpointers.com/offers/",
        "https://cardpointers.com/offers/menchies-frozen-yogurt-lake-nona-5-back-48/",
        "https://cardpointers.com/offers/tsuki-sushi-grill-5-back-50/"
      ]
    },
    {
      "key": "/cards",
      "pages": 14,
      "share": 0.24,
      "template": "entity",
      "avgWords": 582,
      "schemaTypes": [],
      "topTerms": [],
      "hub": "https://cardpointers.com/cards/",
      "examples": [
        "https://cardpointers.com/cards/",
        "https://cardpointers.com/cards/chase-sapphire-reserve-new/",
        "https://cardpointers.com/cards/american-express-gold-card/"
      ]
    },
    {
      "key": "/apps",
      "pages": 7,
      "share": 0.12,
      "template": "other",
      "avgWords": 372,
      "schemaTypes": [],
      "topTerms": [
        "apple"
      ],
      "hub": "https://cardpointers.com/apps/iphone/",
      "examples": [
        "https://cardpointers.com/apps/iphone/",
        "https://cardpointers.com/apps/ipad/",
        "https://cardpointers.com/apps/watch/"
      ]
    },
    {
      "key": "/gift",
      "pages": 2,
      "share": 0.03,
      "template": "other",
      "avgWords": 311,
      "schemaTypes": [],
      "topTerms": [
        "gift card"
      ],
      "hub": null,
      "examples": [
        "https://cardpointers.com/gift/",
        "https://cardpointers.com/gift/redeem/?id=undefined"
      ]
    },
    {
      "key": "/",
      "pages": 1,
      "share": 0.02,
      "template": "home",
      "avgWords": 483,
      "schemaTypes": [],
      "topTerms": [],
      "hub": null,
      "examples": [
        "https://cardpointers.com/"
      ]
    },
    {
      "key": "/account",
      "pages": 1,
      "share": 0.02,
      "template": "other",
      "avgWords": 525,
      "schemaTypes": [],
      "topTerms": [],
      "hub": null,
      "examples": [
        "https://cardpointers.com/account/"
      ]
    },
    {
      "key": "/ai",
      "pages": 1,
      "share": 0.02,
      "template": "other",
      "avgWords": 270,
      "schemaTypes": [],
      "topTerms": [],
      "hub": null,
      "examples": [
        "https://cardpointers.com/ai/"
      ]
    },
    {
      "key": "/app",
      "pages": 1,
      "share": 0.02,
      "template": "product",
      "avgWords": 24,
      "schemaTypes": [],
      "topTerms": [],
      "hub": null,
      "examples": [
        "https://cardpointers.com/app/"
      ]
    },
    {
      "key": "/extension",
      "pages": 1,
      "share": 0.02,
      "template": "other",
      "avgWords": 337,
      "schemaTypes": [],
      "topTerms": [],
      "hub": null,
      "examples": [
        "https://cardpointers.com/extension/"
      ]
    },
    {
      "key": "/forgot",
      "pages": 1,
      "share": 0.02,
      "template": "other",
      "avgWords": 122,
      "schemaTypes": [],
      "topTerms": [],
      "hub": null,
      "examples": [
        "https://cardpointers.com/forgot/"
      ]
    },
    {
      "key": "/login",
      "pages": 1,
      "share": 0.02,
      "template": "other",
      "avgWords": 140,
      "schemaTypes": [],
      "topTerms": [],
      "hub": null,
      "examples": [
        "https://cardpointers.com/login/"
      ]
    },
    {
      "key": "/privacy",
      "pages": 1,
      "share": 0.02,
      "template": "legal",
      "avgWords": 1176,
      "schemaTypes": [],
      "topTerms": [],
      "hub": null,
      "examples": [
        "https://cardpointers.com/privacy/"
      ]
    }
  ],
  "templates": [
    {
      "type": "entity",
      "pages": 37,
      "avgWords": 344,
      "examples": [
        "https://cardpointers.com/offers/menchies-frozen-yogurt-lake-nona-5-back-48/",
        "https://cardpointers.com/offers/tsuki-sushi-grill-5-back-50/",
        "https://cardpointers.com/offers/handels-homemade-ice-cream-oviedo-5-back/"
      ]
    },
    {
      "type": "other",
      "pages": 18,
      "avgWords": 391,
      "examples": [
        "https://cardpointers.com/apps/iphone/",
        "https://cardpointers.com/apps/ipad/",
        "https://cardpointers.com/apps/watch/"
      ]
    },
    {
      "type": "comparison",
      "pages": 1,
      "avgWords": 536,
      "examples": [
        "https://cardpointers.com/cards/"
      ]
    },
    {
      "type": "home",
      "pages": 1,
      "avgWords": 483,
      "examples": [
        "https://cardpointers.com/"
      ]
    },
    {
      "type": "legal",
      "pages": 1,
      "avgWords": 1176,
      "examples": [
        "https://cardpointers.com/privacy/"
      ]
    },
    {
      "type": "product",
      "pages": 1,
      "avgWords": 24,
      "examples": [
        "https://cardpointers.com/app/"
      ]
    }
  ],